{
  "$schema": "https://tabnas.github.io/measure/schemas/matrix.schema.json",
  "schemaVersion": 3,
  "run": {
    "id": "20260915T171236462Z-063cd3b35d2f-suite-0.2.0-461e0cbc",
    "generatedAt": "2026-09-15T17:12:36.462Z",
    "profile": "full",
    "suiteVersion": "0.2.0",
    "repositoryCommit": "461e0cbcd91dcfbe27d8cd69ffc2fef018a43adb",
    "repositoryDirty": false
  },
  "ports": [
    {
      "id": "typescript",
      "label": "TypeScript / Node.js",
      "language": "TypeScript",
      "runtime": "Node.js",
      "runtimeVersion": "v24.21.0",
      "parserModule": "@tabnas/parser",
      "parserVersion": "0.9.7",
      "environment": {
        "fingerprint": "2e786edca5574fb6b21f15751f3479f2a1aba3d072d6f8017da919fd2fb0956a",
        "hostFingerprint": "063cd3b35d2f",
        "os": "linux",
        "osName": "Ubuntu 24.04.4 LTS",
        "kernelVersion": "6.18.44-fc-v33",
        "arch": "amd64",
        "cpu": "Intel(R) Xeon(R) Processor @ 2.80GHz",
        "logicalCpus": 4,
        "memoryBytes": 16877793280
      }
    },
    {
      "id": "go",
      "label": "Go",
      "language": "Go",
      "runtime": "Go",
      "runtimeVersion": "go1.26.0",
      "parserModule": "github.com/tabnas/parser/go",
      "parserVersion": "0.9.7",
      "environment": {
        "fingerprint": "2e786edca5574fb6b21f15751f3479f2a1aba3d072d6f8017da919fd2fb0956a",
        "hostFingerprint": "063cd3b35d2f",
        "os": "linux",
        "osName": "Ubuntu 24.04.4 LTS",
        "kernelVersion": "6.18.44-fc-v33",
        "arch": "amd64",
        "cpu": "Intel(R) Xeon(R) Processor @ 2.80GHz",
        "logicalCpus": 4,
        "memoryBytes": 16877793280
      }
    },
    {
      "id": "rust",
      "label": "Rust",
      "language": "Rust",
      "runtime": "Rust",
      "runtimeVersion": "1.94.1",
      "parserModule": "tabnas",
      "parserVersion": "0.9.7",
      "environment": {
        "fingerprint": "2e786edca5574fb6b21f15751f3479f2a1aba3d072d6f8017da919fd2fb0956a",
        "hostFingerprint": "063cd3b35d2f",
        "os": "linux",
        "osName": "Ubuntu 24.04.4 LTS",
        "kernelVersion": "6.18.44-fc-v33",
        "arch": "amd64",
        "cpu": "Intel(R) Xeon(R) Processor @ 2.80GHz",
        "logicalCpus": 4,
        "memoryBytes": 16877793280
      }
    }
  ],
  "benchmarks": [
    {
      "id": "adder",
      "title": "Adder grammar",
      "summary": "Canonical Tabnas integer-addition grammar with semantic accumulation.",
      "classification": [
        "deterministic",
        "semantic-action",
        "repetition"
      ],
      "reference": {
        "label": "Tabnas quickstart",
        "url": "https://tabnas.dev/docs/quickstart"
      }
    },
    {
      "id": "palindrome",
      "title": "Even palindromes",
      "summary": "Classic non-deterministic context-free language resolved with full parse context.",
      "classification": [
        "non-deterministic-context-free",
        "state-aware",
        "recursive"
      ],
      "reference": {
        "label": "Context-free recognition summary",
        "url": "https://www.cs.utahtech.edu/cs/3530/examples.examples/chapter02-contextfreelanguages.pdf"
      }
    }
  ],
  "capabilityMatrix": [
    {
      "benchmarkId": "adder",
      "caseId": "single",
      "description": "One number is a complete expression.",
      "acceptExpected": true,
      "expected": 1,
      "ports": {
        "typescript": {
          "accepted": true,
          "passed": true,
          "actual": 1
        },
        "go": {
          "accepted": true,
          "passed": true,
          "actual": 1
        },
        "rust": {
          "accepted": true,
          "passed": true,
          "actual": 1
        }
      }
    },
    {
      "benchmarkId": "adder",
      "caseId": "chain",
      "description": "Three terms accumulate on the parent node.",
      "acceptExpected": true,
      "expected": 6,
      "ports": {
        "typescript": {
          "accepted": true,
          "passed": true,
          "actual": 6
        },
        "go": {
          "accepted": true,
          "passed": true,
          "actual": 6
        },
        "rust": {
          "accepted": true,
          "passed": true,
          "actual": 6
        }
      }
    },
    {
      "benchmarkId": "adder",
      "caseId": "multi-digit",
      "description": "Multi-digit number tokens retain their numeric values.",
      "acceptExpected": true,
      "expected": 60,
      "ports": {
        "typescript": {
          "accepted": true,
          "passed": true,
          "actual": 60
        },
        "go": {
          "accepted": true,
          "passed": true,
          "actual": 60
        },
        "rust": {
          "accepted": true,
          "passed": true,
          "actual": 60
        }
      }
    },
    {
      "benchmarkId": "adder",
      "caseId": "trailing-plus",
      "description": "A plus sign must be followed by another number.",
      "acceptExpected": false,
      "ports": {
        "typescript": {
          "accepted": false,
          "passed": true
        },
        "go": {
          "accepted": false,
          "passed": true
        },
        "rust": {
          "accepted": false,
          "passed": true
        }
      }
    },
    {
      "benchmarkId": "adder",
      "caseId": "leading-plus",
      "description": "An expression cannot begin with plus.",
      "acceptExpected": false,
      "ports": {
        "typescript": {
          "accepted": false,
          "passed": true
        },
        "go": {
          "accepted": false,
          "passed": true
        },
        "rust": {
          "accepted": false,
          "passed": true
        }
      }
    },
    {
      "benchmarkId": "adder",
      "caseId": "double-plus",
      "description": "An empty term between plus signs is rejected.",
      "acceptExpected": false,
      "ports": {
        "typescript": {
          "accepted": false,
          "passed": true
        },
        "go": {
          "accepted": false,
          "passed": true
        },
        "rust": {
          "accepted": false,
          "passed": true
        }
      }
    },
    {
      "benchmarkId": "adder",
      "caseId": "unknown-token",
      "description": "Unrecognized arithmetic syntax is rejected.",
      "acceptExpected": false,
      "ports": {
        "typescript": {
          "accepted": false,
          "passed": true
        },
        "go": {
          "accepted": false,
          "passed": true
        },
        "rust": {
          "accepted": false,
          "passed": true
        }
      }
    },
    {
      "benchmarkId": "palindrome",
      "caseId": "empty",
      "description": "The empty word belongs to the language.",
      "acceptExpected": true,
      "expected": true,
      "ports": {
        "typescript": {
          "accepted": true,
          "passed": true,
          "actual": true
        },
        "go": {
          "accepted": true,
          "passed": true,
          "actual": true
        },
        "rust": {
          "accepted": true,
          "passed": true,
          "actual": true
        }
      }
    },
    {
      "benchmarkId": "palindrome",
      "caseId": "pair-a",
      "description": "The smallest a palindrome is accepted.",
      "acceptExpected": true,
      "expected": true,
      "ports": {
        "typescript": {
          "accepted": true,
          "passed": true,
          "actual": true
        },
        "go": {
          "accepted": true,
          "passed": true,
          "actual": true
        },
        "rust": {
          "accepted": true,
          "passed": true,
          "actual": true
        }
      }
    },
    {
      "benchmarkId": "palindrome",
      "caseId": "pair-b",
      "description": "The smallest b palindrome is accepted.",
      "acceptExpected": true,
      "expected": true,
      "ports": {
        "typescript": {
          "accepted": true,
          "passed": true,
          "actual": true
        },
        "go": {
          "accepted": true,
          "passed": true,
          "actual": true
        },
        "rust": {
          "accepted": true,
          "passed": true,
          "actual": true
        }
      }
    },
    {
      "benchmarkId": "palindrome",
      "caseId": "nested",
      "description": "Nested unlike symbols match across the midpoint.",
      "acceptExpected": true,
      "expected": true,
      "ports": {
        "typescript": {
          "accepted": true,
          "passed": true,
          "actual": true
        },
        "go": {
          "accepted": true,
          "passed": true,
          "actual": true
        },
        "rust": {
          "accepted": true,
          "passed": true,
          "actual": true
        }
      }
    },
    {
      "benchmarkId": "palindrome",
      "caseId": "length-six",
      "description": "A three-symbol first half is mirrored.",
      "acceptExpected": true,
      "expected": true,
      "ports": {
        "typescript": {
          "accepted": true,
          "passed": true,
          "actual": true
        },
        "go": {
          "accepted": true,
          "passed": true,
          "actual": true
        },
        "rust": {
          "accepted": true,
          "passed": true,
          "actual": true
        }
      }
    },
    {
      "benchmarkId": "palindrome",
      "caseId": "odd-length",
      "description": "No midpoint between symbols exists.",
      "acceptExpected": false,
      "ports": {
        "typescript": {
          "accepted": false,
          "passed": true
        },
        "go": {
          "accepted": false,
          "passed": true
        },
        "rust": {
          "accepted": false,
          "passed": true
        }
      }
    },
    {
      "benchmarkId": "palindrome",
      "caseId": "not-mirrored",
      "description": "Equal-length halves that are not reverses fail.",
      "acceptExpected": false,
      "ports": {